{
  "$schema": "http://json-schema.org/draft-07/schema#",
  "type": [
    "object",
    "null"
  ],
  "title": "Case Fan Schema",
  "description": "Schema for case fan components",
  "required": [
    "metadata"
  ],
  "properties": {
    "opendb_id": {
      "type": [
        "string",
        "null"
      ],
      "description": "Unique identifier for the document (UUID v4)"
    },
    "size": {
      "type": [
        "number",
        "null"
      ],
      "description": "The fan size in mm (e.g., 120)"
    },
    "color": {
      "type": [
        "array",
        "null"
      ],
      "items": {
        "type": [
          "string",
          "null"
        ]
      },
      "description": "The color of this product (e.g., ['Black', 'Red']). Each color of the product should be included in the array."
    },
    "quantity": {
      "type": [
        "number",
        "null"
      ],
      "description": "Number of fans included in the package (e.g., 3). Important for multi-packs"
    },
    "min_airflow": {
      "type": [
        "number",
        "null"
      ],
      "description": "The minimum airflow of the fan in CFM. If it is a constant, just fill in min_airflow and ignore max_airflow"
    },
    "max_airflow": {
      "type": [
        "number",
        "null"
      ],
      "description": "The maximum airflow of the fan in CFM. If it is a constant, just fill in min_airflow and ignore max_airflow"
    },
    "min_noise_level": {
      "type": [
        "number",
        "null"
      ],
      "description": "The minimum noise level of the fan in dB. If it is a constant, just fill in min_noise_level and ignore max_noise_level"
    },
    "max_noise_level": {
      "type": [
        "number",
        "null"
      ],
      "description": "The maximum noise level of the fan in dB. If it is a constant, just fill in min_noise_level and ignore max_noise_level"
    },
    "pwm": {
      "type": [
        "boolean",
        "null"
      ],
      "description": "Whether the fan supports Pulse Width Modulation for speed control"
    },
    "led": {
      "type": [
        "string",
        "null"
      ],
      "description": "The type of LED lighting, if any (e.g., 'Addressable RGB', 'RGB', 'None')"
    },
    "connector": {
      "type": [
        "string",
        "null"
      ],
      "description": "The type of connector(s) the fan uses (e.g., '4-pin PWM + 3-pin 5V Addressable RGB')"
    },
    "controller": {
      "type": [
        "string",
        "null"
      ],
      "description": "If the fan includes a controller, specify the type (e.g., '5V Addressable RGB'). Otherwise, indicate 'None'"
    },
    "static_pressure": {
      "type": [
        "number",
        "null"
      ],
      "description": "The static pressure of the fan in mmHâ‚‚O"
    },
    "flow_direction": {
      "type": [
        "string",
        "null"
      ],
      "description": "The direction of the airflow (e.g., 'Standard', 'Reverse')"
    },
    "metadata": {
      "type": [
        "object",
        "null"
      ],
      "required": [
        "name"
      ],
      "properties": {
        "name": {
          "type": "string",
          "description": "Full product name"
        },
        "manufacturer": {
          "type": [
            "string",
            "null"
          ],
          "description": "Product manufacturer"
        },
        "part_numbers": {
          "type": [
            "array",
            "null"
          ],
          "items": {
            "type": "string"
          },
          "description": "Array of manufacturer's part numbers/SKUs"
        },
        "series": {
          "type": [
            "string",
            "null"
          ],
          "description": "Product series name"
        },
        "variant": {
          "type": [
            "string",
            "null"
          ],
          "description": "Specific variant in the series"
        },
        "releaseYear": {
          "type": [
            "number",
            "null"
          ],
          "description": "Year of release"
        }
      }
    },
    "general_product_information": {
      "type": [
        "object",
        "null"
      ],
      "description": "General product information and retailer SKUs",
      "properties": {
        "amazon_sku": {
          "type": [
            "string",
            "null"
          ],
          "description": "Amazon product SKU"
        },
        "newegg_sku": {
          "type": [
            "string",
            "null"
          ],
          "description": "Newegg product SKU"
        },
        "bestbuy_sku": {
          "type": [
            "number",
            "null"
          ],
          "description": "Best Buy product SKU"
        },
        "walmart_sku": {
          "type": [
            "number",
            "null"
          ],
          "description": "Walmart product SKU"
        },
        "adorama_sku": {
          "type": [
            "string",
            "null"
          ],
          "description": "Adorama product SKU"
        },
        "manufacturer_url": {
          "type": [
            "string",
            "null"
          ],
          "description": "Official manufacturer product URL"
        }
      }
    }
  }
}