{
  "opendb_id": "c1caf142-e09d-4f53-b1a4-8b45f3e96c01",
  "metadata": {
    "name": "Rosewill RNBL-131209R 120mm Black Red LED 59.8 CFM",
    "manufacturer": "Rosewill",
    "part_numbers": [],
    "series": "RNBL-131209R",
    "variant": "120mm Black"
  },
  "size": 120,
  "color": [
    "BLACK"
  ],
  "quantity": 1,
  "min_airflow": 59.8,
  "max_airflow": null,
  "min_noise_level": 36,
  "max_noise_level": null,
  "pwm": false,
  "led": "Red",
  "connector": "3-pin",
  "controller": "None",
  "static_pressure": null,
  "flow_direction": "Standard",
  "general_product_information": {}
}