{
  "opendb_id": "5e271ab9-0160-47e6-abb6-b523cd345d53",
  "metadata": {
    "name": "Iceberg Thermal IceGALE 140mm Gray PWM 2-Pack",
    "manufacturer": "Iceberg Thermal",
    "part_numbers": [],
    "series": "IceGALE",
    "variant": "140mm Gray"
  },
  "size": 140,
  "color": [
    "GREY"
  ],
  "quantity": 2,
  "min_airflow": 96,
  "max_airflow": null,
  "min_noise_level": 0,
  "max_noise_level": 36,
  "pwm": true,
  "led": "None",
  "connector": "4-pin PWM",
  "controller": "None",
  "static_pressure": 2.65,
  "flow_direction": "Standard",
  "general_product_information": {
    "amazon_sku": "B08NWJCFR5",
    "newegg_sku": "1YF-0184-00029"
  }
}