{
  "opendb_id": "202ec9c6-34a0-414b-8ddb-0156a4d1192e",
  "metadata": {
    "name": "Deepcool FK120 120mm Black PWM 68.99 CFM",
    "manufacturer": "Deepcool",
    "part_numbers": [],
    "series": "FK120",
    "variant": "120mm Black"
  },
  "size": 120,
  "color": [
    "BLACK"
  ],
  "quantity": 1,
  "min_airflow": 68.99,
  "max_airflow": null,
  "min_noise_level": 28,
  "max_noise_level": null,
  "pwm": true,
  "led": "None",
  "connector": "4-pin PWM",
  "controller": "None",
  "static_pressure": 2.19,
  "flow_direction": "Standard",
  "general_product_information": {}
}