{
  "opendb_id": "662a7733-62f0-412b-b9dd-09df6d2db664",
  "metadata": {
    "name": "be quiet! Silent Wings 2 140mm Black PWM 60.4 CFM",
    "manufacturer": "be quiet!",
    "part_numbers": [],
    "series": "Silent",
    "variant": "140mm Black"
  },
  "size": 140,
  "color": [
    "BLACK"
  ],
  "quantity": 1,
  "min_airflow": 60.4,
  "max_airflow": null,
  "min_noise_level": 16.4,
  "max_noise_level": null,
  "pwm": true,
  "led": "None",
  "connector": "4-pin PWM",
  "controller": "None",
  "static_pressure": 0.81,
  "flow_direction": "Standard",
  "general_product_information": {}
}