{
  "opendb_id": "2e5eedb8-ad15-4224-9928-5a73d63b3d69",
  "metadata": {
    "name": "Alpenföhn JetStream 120mm Black PWM 55.326 CFM",
    "manufacturer": "Alpenföhn",
    "part_numbers": [],
    "series": "JetStream",
    "variant": "120mm Black"
  },
  "size": 120,
  "color": [
    "BLACK"
  ],
  "quantity": 1,
  "min_airflow": 55.326,
  "max_airflow": null,
  "min_noise_level": 22.8,
  "max_noise_level": null,
  "pwm": true,
  "led": "None",
  "connector": "4-pin PWM",
  "controller": "None",
  "static_pressure": 1.74,
  "flow_direction": "Standard",
  "general_product_information": {}
}