{
  "opendb_id": "23d6bbbc-9579-4b22-8120-fe41f89fe9a3",
  "metadata": {
    "name": "Akasa Vegas TLY 140mm Black / White 41.2 CFM Addressable RGB",
    "manufacturer": "Akasa",
    "part_numbers": [],
    "series": "Vegas",
    "variant": "140mm Black / White"
  },
  "size": 140,
  "color": [
    "BLACK",
    "WHITE"
  ],
  "quantity": 1,
  "min_airflow": 41.2,
  "max_airflow": null,
  "min_noise_level": 21.2,
  "max_noise_level": null,
  "pwm": false,
  "led": "Addressable RGB",
  "connector": "3-pin + 3-pin 5V Addressable RGB",
  "controller": "None",
  "static_pressure": 1.24,
  "flow_direction": "Standard",
  "general_product_information": {}
}