{
  "opendb_id": "125d7114-1642-436f-88ab-365f9fe46a8f",
  "metadata": {
    "name": "BitFenix Spectre 120mm Black Red LED",
    "manufacturer": "BitFenix",
    "part_numbers": [],
    "series": "Spectre",
    "variant": "120mm Black"
  },
  "size": 120,
  "color": [
    "BLACK"
  ],
  "quantity": 1,
  "min_airflow": 43.5,
  "max_airflow": null,
  "min_noise_level": 20,
  "max_noise_level": null,
  "pwm": false,
  "led": "Red",
  "connector": "3-pin",
  "controller": "None",
  "static_pressure": null,
  "flow_direction": "Standard",
  "general_product_information": {}
}