{
  "opendb_id": "eba5fb0b-6a70-4a56-9ddc-a4690978ad96",
  "metadata": {
    "name": "Zalman F1 80mm Black / Clear 1-Pack",
    "manufacturer": "Zalman",
    "part_numbers": [],
    "series": "F1",
    "variant": "80mm Black / Clear"
  },
  "size": 80,
  "color": [
    "BLACK",
    "WHITE"
  ],
  "quantity": 1,
  "min_airflow": null,
  "max_airflow": null,
  "min_noise_level": 18,
  "max_noise_level": 23,
  "pwm": false,
  "led": "None",
  "connector": "3-pin",
  "controller": "None",
  "static_pressure": null,
  "flow_direction": "Standard",
  "general_product_information": {}
}