{
  "opendb_id": "5b0f124a-7f9a-4f29-b5ed-d4b77eac52d8",
  "metadata": {
    "name": "ARCTIC P PST 140mm White PWM Addressable RGB 68.9 CFM",
    "manufacturer": "ARCTIC",
    "part_numbers": [],
    "series": "P",
    "variant": "140mm White"
  },
  "size": 140,
  "color": [
    "WHITE"
  ],
  "quantity": 1,
  "min_airflow": 68.9,
  "max_airflow": null,
  "min_noise_level": 22.5,
  "max_noise_level": null,
  "pwm": true,
  "led": "Addressable RGB",
  "connector": "4-pin PWM + 3-pin 5V Addressable RGB",
  "controller": "None",
  "static_pressure": 2,
  "flow_direction": "Standard",
  "general_product_information": {
    "amazon_sku": "B09VDQ1L6C",
    "walmart_sku": 5085817423
  }
}