{
  "opendb_id": "c010ec58-9633-45e3-b455-477f00f55011",
  "metadata": {
    "name": "Iceberg Thermal IceGALE 120mm Teal / White ARGB PWM 94 CFM 1-Pack",
    "manufacturer": "Iceberg Thermal",
    "part_numbers": [],
    "series": "IceGALE",
    "variant": "120mm Teal / White"
  },
  "size": 120,
  "color": [
    "WHITE",
    "BLUE"
  ],
  "quantity": 1,
  "min_airflow": 94,
  "max_airflow": null,
  "min_noise_level": 0,
  "max_noise_level": 38,
  "pwm": true,
  "led": "Addressable RGB",
  "connector": "Proprietary PWM + 3-pin 5V Addressable RGB",
  "controller": "None",
  "static_pressure": 3.27,
  "flow_direction": "Standard",
  "general_product_information": {
    "amazon_sku": "B08P2DVD1X"
  }
}