{
  "opendb_id": "0594c1d8-6f08-4e4c-a22b-d5a65f081687",
  "metadata": {
    "name": "Thermaltake Riing 140mm Black / White White LED 51.15 CFM 1-Pack",
    "manufacturer": "Thermaltake",
    "part_numbers": [],
    "series": "Riing",
    "variant": "140mm Black / White"
  },
  "size": 140,
  "color": [
    "BLACK",
    "WHITE"
  ],
  "quantity": 1,
  "min_airflow": 51.15,
  "max_airflow": null,
  "min_noise_level": 22.1,
  "max_noise_level": 28.1,
  "pwm": false,
  "led": "White",
  "connector": "3-pin",
  "controller": "None",
  "static_pressure": 1.58,
  "flow_direction": "Standard",
  "general_product_information": {
    "amazon_sku": "B00WB9MMFE",
    "walmart_sku": 46480970
  }
}