{
  "opendb_id": "b5fc5210-19c4-4013-bfbb-7e92ba3bd2af",
  "metadata": {
    "name": "Corsair iCUE QL140 140mm Black PWM RGB 50.2 CFM 2-Pack",
    "manufacturer": "Corsair",
    "part_numbers": [],
    "series": "iCUE",
    "variant": "140mm Black"
  },
  "size": 140,
  "color": [
    "BLACK"
  ],
  "quantity": 2,
  "min_airflow": 50.2,
  "max_airflow": null,
  "min_noise_level": 26,
  "max_noise_level": null,
  "pwm": true,
  "led": "RGB",
  "connector": "4-pin PWM + Proprietary RGB",
  "controller": "Manual",
  "static_pressure": 1.4,
  "flow_direction": "Standard",
  "general_product_information": {
    "amazon_sku": "B07Z9SSKKP",
    "walmart_sku": 227685288
  }
}