{
  "opendb_id": "dd081a39-15bd-41f8-beb2-2667b0242218",
  "metadata": {
    "name": "Xigmatek Crystal 120mm Clear Green LED",
    "manufacturer": "Xigmatek",
    "part_numbers": [],
    "series": "Crystal",
    "variant": "120mm Clear"
  },
  "size": 120,
  "color": [
    "WHITE"
  ],
  "quantity": 1,
  "min_airflow": 68.33,
  "max_airflow": null,
  "min_noise_level": 20,
  "max_noise_level": null,
  "pwm": false,
  "led": "Green",
  "connector": "3-pin",
  "controller": "None",
  "static_pressure": null,
  "flow_direction": "Standard",
  "general_product_information": {}
}