{
  "opendb_id": "1789570b-cd05-45f1-bec7-ff13a9d9c46f",
  "metadata": {
    "name": "ARCTIC P PST 140mm Black / Transparent PWM RGB 3-Pack",
    "manufacturer": "ARCTIC",
    "part_numbers": [],
    "series": "P",
    "variant": "140mm Black / Transparent"
  },
  "size": 140,
  "color": [
    "BLACK",
    "RGB"
  ],
  "quantity": 3,
  "min_airflow": 68.9,
  "max_airflow": null,
  "min_noise_level": 0,
  "max_noise_level": 68.9,
  "pwm": true,
  "led": "RGB",
  "connector": "4-pin PWM + 4-pin 12V RGB",
  "controller": "None",
  "static_pressure": 2,
  "flow_direction": "Standard",
  "general_product_information": {}
}