{
  "opendb_id": "407999e4-7ccb-4bf4-8b26-93a77af9c8cc",
  "metadata": {
    "name": "Thermalright TL-S12R 120mm Black PWM 47.6 CFM 1-Pack",
    "manufacturer": "Thermalright",
    "part_numbers": [],
    "series": "TL-S12R",
    "variant": "120mm Black"
  },
  "size": 120,
  "color": [
    "BLACK"
  ],
  "quantity": 1,
  "min_airflow": 47.6,
  "max_airflow": null,
  "min_noise_level": 23.2,
  "max_noise_level": null,
  "pwm": true,
  "led": "None",
  "connector": "4-pin PWM",
  "controller": "None",
  "static_pressure": 1.31,
  "flow_direction": "Reverse",
  "general_product_information": {}
}