{
  "opendb_id": "8be9b6cd-5dc7-4617-9197-01b42ca9a481",
  "metadata": {
    "name": "Thermaltake CT120 EX Reverse 120mm Blue ARGB PWM 3-Pack",
    "manufacturer": "Thermaltake",
    "part_numbers": [],
    "series": "CT120",
    "variant": "120mm Blue"
  },
  "size": 120,
  "color": [
    "BLUE"
  ],
  "quantity": 3,
  "min_airflow": 65.82,
  "max_airflow": null,
  "min_noise_level": 31.2,
  "max_noise_level": null,
  "pwm": true,
  "led": "Addressable RGB",
  "connector": "4-pin PWM + 3-pin 5V Addressable RGB",
  "controller": "None",
  "static_pressure": 1.87,
  "flow_direction": "Reverse",
  "general_product_information": {
    "amazon_sku": "B0D7NL3BWC",
    "newegg_sku": "1YF-001G-004C4",
    "walmart_sku": 7356917062
  }
}