{
  "opendb_id": "9afe3ea2-0c25-4389-abde-8593510ad39f",
  "metadata": {
    "name": "LEPA LP70D12R 120mm Black",
    "manufacturer": "LEPA",
    "part_numbers": [],
    "series": "LP70D12R",
    "variant": "120mm Black"
  },
  "size": 120,
  "color": [
    "BLACK"
  ],
  "quantity": 1,
  "min_airflow": null,
  "max_airflow": null,
  "min_noise_level": 24,
  "max_noise_level": null,
  "pwm": false,
  "led": "None",
  "connector": "3-pin",
  "controller": "None",
  "static_pressure": null,
  "flow_direction": "Standard",
  "general_product_information": {}
}