{
  "opendb_id": "fc7952e2-eafc-4572-b2ef-0e7568c506e5",
  "metadata": {
    "name": "Deepcool FT14 140mm White PWM 1-Pack",
    "manufacturer": "Deepcool",
    "part_numbers": [],
    "series": "FT14",
    "variant": "140mm White"
  },
  "size": 140,
  "color": [
    "WHITE"
  ],
  "quantity": 1,
  "min_airflow": 78.83,
  "max_airflow": null,
  "min_noise_level": 25.1,
  "max_noise_level": null,
  "pwm": true,
  "led": "White",
  "connector": "4-pin PWM",
  "controller": "None",
  "static_pressure": 3.6,
  "flow_direction": "Standard",
  "general_product_information": {}
}