{
  "opendb_id": "d741f7db-4103-47b5-892e-1a8493310b89",
  "metadata": {
    "name": "Apevia AF512L-BL 120mm Blue Blue LED 5-Pack",
    "manufacturer": "Apevia",
    "part_numbers": [],
    "series": "AF512L-BL",
    "variant": "120mm Blue"
  },
  "size": 120,
  "color": [
    "BLUE"
  ],
  "quantity": 5,
  "min_airflow": 57.67,
  "max_airflow": null,
  "min_noise_level": 24.7,
  "max_noise_level": null,
  "pwm": false,
  "led": "Blue",
  "connector": "3-pin",
  "controller": "None",
  "static_pressure": null,
  "flow_direction": "Standard",
  "general_product_information": {}
}