{
  "opendb_id": "b184d357-b0af-4e38-b295-0b4344ed331a",
  "metadata": {
    "name": "Thermaltake SWAFAN EX12 120mm Blue / White Addressable RGB PWM 57.11 CFM 3-Pack",
    "manufacturer": "Thermaltake",
    "part_numbers": [],
    "series": "SWAFAN",
    "variant": "120mm Blue / White"
  },
  "size": 120,
  "color": [
    "BLUE",
    "WHITE"
  ],
  "quantity": 3,
  "min_airflow": 56.26,
  "max_airflow": 57.11,
  "min_noise_level": 30.6,
  "max_noise_level": 32.5,
  "pwm": true,
  "led": "Addressable RGB",
  "connector": "4-pin PWM + 3-pin 5V Addressable RGB",
  "controller": "None",
  "static_pressure": 2.39,
  "flow_direction": "Standard",
  "general_product_information": {
    "amazon_sku": "B0CTGMV3TP",
    "newegg_sku": "13C-001H-00267",
    "walmart_sku": 5445870553
  }
}